{
  "contract": "ellmos.trithon.task-projection.v1",
  "projection_id": "proj-00000000000000000000000000000001",
  "source": {
    "route_intent": "ellmos.ticket.route-intent.v1",
    "ticket_id": "T-20990101-123456789",
    "ticket_revision": "sha256:2222222222222222222222222222222222222222222222222222222222222222",
    "route_intent_idempotency_key": "sha256:f702c39a4e0701a8abb97210a91e2f99be4025632c182ce2647f0b257410cdc3",
    "source_status": "ACTIONABLE"
  },
  "task": {
    "task_id": "trithon-task:T-20990101-123456789:222222222222",
    "capability": "software.contracts",
    "priority": "high",
    "task_state": "ready"
  },
  "target_snapshot": {
    "kind": "grouped",
    "systems": ["NODE-A", "NODE-B"],
    "at": "2099-01-01T00:00:00Z",
    "source_ref": "registry:synthetic-systems-v1",
    "fingerprint": "sha256:1111111111111111111111111111111111111111111111111111111111111111"
  },
  "receipt_to": "T-20990101-123456789",
  "delivery": {
    "event_id": "evt-00000000000000000000000000000002",
    "publisher_id": "ticket-master@TEST-NODE",
    "publisher_epoch": "epoch-test-0001",
    "sequence": 11,
    "attempt": 2,
    "emitted_at": "2099-01-01T00:02:00Z"
  },
  "idempotency_key": "sha256:c5a407bf5959fbb9e0d54f0a6ba7a402a843fe9d5f30facd41fb8f3398349680"
}
